{
  "format": "urrf.universal-art-asset-provider-replay.v0.1",
  "version": "0.1.0",
  "replay_id": "urrf-universal-art-asset-provider-replay:79e03c3992b08b2d41203465",
  "source": "urrf-provider-execution-replay-evaluator",
  "asset_id": "asset:cf644862f780b86ae2bd9e94",
  "asset_profile": "character",
  "quality_tier": "AAA",
  "original_execution_root": "936f58b1574821f321de896e82cb2856887b7b118089b2a1b444dbe346436f2d",
  "replay_execution_root": "936f58b1574821f321de896e82cb2856887b7b118089b2a1b444dbe346436f2d",
  "original_request_root": "baa2f245db9524e871ef0eecb5e0151dd137bd347617100e89686bbdaf485cb1",
  "replay_request_root": "baa2f245db9524e871ef0eecb5e0151dd137bd347617100e89686bbdaf485cb1",
  "original_output_root": "44848ca8aa734a91587de32cc1bd6a44d69d70e7ee8f617d73912f8f6fa8e6c9",
  "replay_output_root": "44848ca8aa734a91587de32cc1bd6a44d69d70e7ee8f617d73912f8f6fa8e6c9",
  "provider_id": "provider:taowind:procedural-3d",
  "provider_root": "82bf355a8b42fab295e1e96258e645703292ec27b20f119276e9e161cbb4b006",
  "provider_source": "ragf-reference-provider",
  "execution_mode": "RAGF_REFERENCE_WORKSPACE",
  "replay_attempted": true,
  "replay_execution_performed": true,
  "provider_runtime_performed": false,
  "provider_runtime_replay_required": false,
  "comparison": {
    "request_root_match": true,
    "provider_binding_match": true,
    "mode_match": true,
    "candidate_root_match": true,
    "materialization_root_match": true,
    "output_root_match": true
  },
  "checks": {
    "initial_receipt_valid": true,
    "genome_binding": true,
    "request_binding": true,
    "provider_binding": true,
    "mode_binding": true,
    "replay_receipt_valid": true,
    "replay_runtime_performed": true,
    "provider_runtime_replay_satisfied": true,
    "output_root_comparable": true,
    "output_root_match": true,
    "authority_boundary": true
  },
  "deterministic_claim": "BOUNDED_OUTPUT_ROOT_EQUALITY",
  "replay_status": "COMPLETED",
  "status": "CANDIDATE_PROVIDER_REPLAY_PASS",
  "errors": [],
  "failure": null,
  "candidate_only": true,
  "authoritative": false,
  "canonical_write_authorized": false,
  "aaa_ready": false,
  "release_ready": false,
  "authority": {
    "canonical_owner": "RNCS",
    "representation_owner": "URRF",
    "provider_can_write_authoritative_world_state": false,
    "provider_can_commit": false,
    "acceptance_can_commit": false,
    "rncs_authority_required": true
  },
  "replay_root": "b195f89b360294e2fe5537d18751e3c912a3e321bd1ff2ffd48fbc801ffdaa9b"
}
